,link,text
0,http://www.agroplazma.com,КУКУРУЗА КАТАЛОГ ПОДСОЛНЕЧНИК КАТАЛОГ НУТ КАТАЛОГ ГОРОХ КАТАЛОГ СОРГО КАТАЛОГ ФАСОЛЬ КАТАЛОГ КРУПНЕЙШИЙ ПРОИЗВОДИТЕЛЬ СЕМЯН В РОССИИ КУПИТЬ СЕМЕНА ДЕМО ПЛОЩАДКИ КОМПАНИЯ АГРОПЛАЗМА   селекционное предприятие  которое создает гибриды подсолнечника  кукурузы  сорта и гибриды сорговых культур  самостоятельно производит и реализует их семена  Отвечая потребностям наших клиентов  мы расширяем ассортимент своей продукции по таким культурам  как крупноплодный нут  фасоль и зеленый горошек  За    лет деятельности мы зарегистрировали больше    гибридов подсолнечника  став с      года крупнейшим российским производителем семян этой культуры     гибридов кукурузы     гибридов и сортов сорго  Селекционеры нашей компании создают продукты  которые имеют ценные хозяйственные характеристики  высокую урожайность  Гибриды и сорта Компании АГРОПЛАЗМА имеют разные сроки вегетации и пригодны для выращивания в большинстве природно климатических зон РФ  Нам доверяют  потому что наше предприятие имеет замкнутый цикл производства  Все этапы   от создания до выращивания и продажи   проходят на одном предприятии  Только при таких условиях можно гарантировать высокое качество продукции  Мы   компания производитель  поэтому  покупая семена у нас  Вы можете рассчитывать на оригинальность поставляемого товара и квалифицированное консультативное сопровождение на протяжении всего периода выращивания  Выбирая российского производителя  Вы выбираете уверенное будущее для Ваших детей  АГРОПЛАЗМА в цифрах Каталог   причин почему Вам стоит выбрать компанию АГРОПЛАЗМА Компания АГРОПЛАЗМА крупнейший российский производитель семян подсолнечника Высокий потенциал урожайности гибридов Гибриды адаптированы к почвенно климатическим условиям РФ Самая широкая линейка гибридов подсолнечника и сорго в России У нас Вы можете купить семена подсолнечника  семена кукурузы  семена сорго по выгодной цене Исследования осуществляются при поддержке Фонда Содействия Инновациям Исследования осуществляются при грантовой поддержке Фонда  Сколково  Гибриды компании БОЛЬШЕ ВИДЕО Купить семена подсолнечника  кукурузы  сорго Нужна консультация  Закажите обратный звонок и наш специалист свяжется с вами  ОТПРАВИТЬ Нажимая на кнопку  Вы даете согласие на обработку своих персональных данных География распространения продукции С      года селекционно семеноводческая компания  АГРОПЛАЗМА  является лидером среди российских производителей семян гибридного подсолнечника  сорго и кукурузы по объемам производства и реализации готового семенного материала  а также по селекции новых сортов и гибридов  Более        га засеяно гибридами подсолнечника компании в    регионах РФ  Одно из ведущих направлений компании   внешнеэкономическая деятельность  Компания  АГРОПЛАЗМА    это крупнейшая российская семенная компания экспортирующая семена гибридов подсолнечника и сорго  Гибриды компании зарегистрированы и успешно экспортируются в такие страны  как Казахстан  Турция  Пакистан  Беларусь  Украина  Компания  АГРОПЛАЗМА  рада предложить своим клиентам купить СЕМЕНА ПОДСОЛНЕЧНИКА  СЕМЕНА КУКУРУЗЫ  СЕМЕНА СОРГО по самой выгодной цене  от производителя  Мы гарантируем высокое качество нашей продукции и дорожим репутацией компании              РОССИЯ БЕЛАРУСЬ КАЗАХСТАН ПАКИСТАН ТУРЦИЯ УКРАИНА Свидетельства и Патенты Новости На территории опытной станции Ставропольского    В рамках реализации гранта Приоритет      в части стратегических проектов по селекции и семеноводству сельскохозяйственных культур  сотрудники факультета агробиологии и земельных ресурсов СтГАУ совместно с представителем компании ООО  АГРОПЛАЗМА  п    Российский Агропромышленный Саммит    февраля      года в Москве состоялся Российский Агропромышленный Саммит  в котором приняли участие около     участников   представителей агропромышленных компаний РФ  Николай Иванович Бенко  опытный селекционер и глава компании  АГРОПЛАЗМА     Приглашаем на бесплатную презентацию  Как ко    Как сельхозпроизводителям компенсировать     затрат на посевной материал субсидией  Приглашаем всех желающих на бесплатную презентацию  где вы сможете получить ответ на этот вопрос и не только   Презентация пройдет в рамках международной сельскохозяйстве     Золотая осень           золотая медаль На    й Российской агропромышленной выставке  Золотая осень          компания  АГРОПЛАЗМА  завоевала золотую медаль  В рамках выставки традиционно прошли отраслевые конкурсы департаментов и подведомственных организаций Минсе    НАВИГАЦИЯ ПО САЙТУ  Главная Продукция Прайс лист Где купить  Медиа О компании Контакты Карта урожайности ПРОДУКЦИЯ  Гибриды Кукурузы Гибриды Подсолнечника Сорго зерновое Сорго сахарное Сорго суданковые гибриды Нут КОНТАКТЫ         г  Краснодар  ул Красных Партизан                                  Тел                                ООО  АГРОПЛАЗМА  Политика конфиденциальности Сделано в компании                    
1,http://ro-met.com,О компании Главная   О компании КОМПАНИЯ АГРОПЛАЗМА НАША ИСТОРИЯ НАШИ ЦЕННОСТИ НАШИ ПАРТНЕРЫ НАВИГАЦИЯ ПО САЙТУ  Главная Продукция Прайс лист Где купить  Медиа О компании Контакты Карта урожайности ПРОДУКЦИЯ  Гибриды Кукурузы Гибриды Подсолнечника Сорго зерновое Сорго сахарное Сорго суданковые гибриды Нут КОНТАКТЫ         г  Краснодар  ул Красных Партизан                                  Тел                                ООО  АГРОПЛАЗМА  Политика конфиденциальности Сделано в компании                    Центр физических испытаний материалов и устройств Главная О компании ЦКП Сколково Реализованные проекты Новости в Телеграмм Контакты                                 Выберите интересующее вас направление Физические испытания ООО  Ромет  является аккредитованным Центром коллективного пользования  ЦКП  Технопарка Сколково  Исследования осуществляются при грантовой поддержке Фонда  Сколково   Выбрать Прототипирование Производственный участок  способный создавать  изготавливать и дорабатывать прототипы изделий  Осуществляется при грантовой поддержке Фонда  Сколково   Выбрать                                                   Главная О компании ЦКП Сколково Реализованные проекты Новости в Телеграмм Контакты Услуги Инновационный проект  МММ  Политика конфиденциальности Разработано в           
